### ISSUE TITLE
New homer server setup Receiving HEP packets but DB not populated

### ISSUE THREAD

**Issue by gunjanmk** [sipcapture/homer#229]
New homer server setup Receiving HEP packets but DB not populated.

Am i missing something.

+++++++

/home/scsupport# ngrep host 10.224.0.1
interface: eth0 (10.224.2.0/255.255.255.0)
filter: (ip or ip6) and ( host 10.224.0.1 )
^Cexit
4 received, 0 dropped
root@HomerTest:/home/scsupport#
root@HomerTest:/home/scsupport#
root@HomerTest:/home/scsupport# ngrep -W byline -d eth0 port 9060
interface: eth0 (10.224.2.0/255.255.255.0)
filter: (ip or ip6) and ( port 9060 )
^Cexit
4 received, 0 dropped
root@HomerTest:/home/scsupport# ^C
root@HomerTest:/home/scsupport# ngrep -W byline -d eth0 port 9060
interface: eth0 (10.224.2.0/255.255.255.0)
filter: (ip or ip6) and ( port 9060 )
#
U 10.224.0.1:60268 -> 10.224.2.34:9060
HEP3.0...................................
Y......
.
................
.........
;d.X.....
g7tA......myhep......SIP/2.0 200 OK.
Via: SIP/2.0/UDP 103.55.116.65:5060;branch=z9hG4bK2c37e919;rport.
From: "2talkpbx" <sip:2talkpbx@103.55.116.65>;tag=as37e6c52b.
To: "61871325603" <sip:61871325603@59.100.15.88:1037>;tag=F358C490-1B22BE79.
CSeq: 102 OPTIONS.
Call-ID: 10663d02098c338b18444a5558c7dcec@103.55.116.65.
Contact: <sip:61871325603@59.100.15.88:1037>.
Allow: INVITE, ACK, BYE, CANCEL, OPTIONS, INFO, MESSAGE, SUBSCRIBE, NOTIFY, PRACK, UPDATE, REFER.
Supported: replaces,100rel,100rel,timer,replaces,norefersub,sdp-anat.
User-Agent: PolycomVVX-VVX_300-UA/5.2.2.1522.
Accept-Language: en.
Accept: application/sdp,text/plain,message/sipfrag,application/dialog-info+xml.
Accept-Encoding: identity.
Content-Length: 0.

+++++++

mysql> show tables;
+-----------------------------------+
| Tables_in_homer_data              |
+-----------------------------------+
| isup_capture_all_20170508         |
| isup_capture_all_20170509         |
| isup_capture_all_20170510         |
| logs_capture                      |
| report_capture                    |
| rtcp_capture                      |
| rtcp_capture_all_20170216         |
| sip_capture_call_20170508         |
| sip_capture_call_20170509         |
| sip_capture_call_20170510         |
| sip_capture_registration_20170508 |
| sip_capture_registration_20170509 |
| sip_capture_registration_20170510 |
| sip_capture_rest_20170508         |
| sip_capture_rest_20170509         |
| sip_capture_rest_20170510         |
| webrtc_capture                    |
| webrtc_capture_all_20170508       |
| webrtc_capture_all_20170509       |
| webrtc_capture_all_20170510       |
+-----------------------------------+
20 rows in set (0.00 sec)

mysql> select * from sip_capture_rest_20170508;
Empty set (0.00 sec)

mysql> select * from sip_capture_call_20170508;
Empty set (0.00 sec)

mysql> select * from sip_capture_registration_20170508;
Empty set (0.00 sec)

**Comment by adubovikov** [comment]
check if any capture server is running on port 9060 also check the logs

**Comment by gunjanmk** [comment]
Hi 

Looking at this my captagent server is sending logs to port 9060. 

14:10:58.700669 ethertype IPv4, IP 10.224.0.1.60268 > 10.224.2.34.9060: UDP, length 761
14:10:58.700670 ethertype IPv4, IP 10.224.0.1.60268 > 10.224.2.34.9060: UDP, length 761
14:10:58.700676 IP 10.224.0.1.60268 > 10.224.2.34.9060: UDP, length 684
14:10:58.700677 ethertype IPv4, IP 10.224.0.1.60268 > 10.224.2.34.9060: UDP, length 684
14:10:58.700677 ethertype IPv4, IP 10.224.0.1.60268 > 10.224.2.34.9060: UDP, length 684
14:10:58.700684 IP 10.224.0.1.60268 > 10.224.2.34.9060: UDP, length 957
14:10:58.700685 ethertype IPv4, IP 10.224.0.1.60268 > 10.224.2.34.9060: UDP, length 957
14:10:58.700686 ethertype IPv4, IP 10.224.0.1.60268 > 10.224.2.34.9060: UDP, length 957
14:10:58.700692 IP 10.224.0.1.60268 > 10.224.2.34.9060: UDP, length 684
14:10:58.700693 ethertype IPv4, IP 10.224.0.1.60268 > 10.224.2.34.9060: UDP, length 684
14:10:58.700694 ethertype IPv4, IP 10.224.0.1.60268 > 10.224.2.34.9060: UDP, length 684
14:10:58.700703 IP 10.224.0.1.60268 > 10.224.2.34.9060: UDP, length 805
14:10:58.700704 ethertype IPv4, IP 10.224.0.1.60268 > 10.224.2.34.9060: UDP, length 805


Any specific log file should i look for ?

**Comment by adubovikov** [comment]
Is anything listening on the port 9060 ?

**Comment by adubovikov** [comment]
@gunjanmk here is not issue, please send this question to the mail-list. Thank you!
